[
  {
    "id": "watashi",
    "kana": "わたし",
    "kanji": null,
    "reading": "わたし",
    "pos": "noun",
    "transitivity": null,
    "english": ["I", "me"],
    "pitch_accent": { "pattern": "heiban", "drop_after_mora": 0 },
    "example_sentences": [
      { "kana": "わたし は がくせい です。", "kanji": null, "english": "I am a student." }
    ],
    "module_introduced": 1,
    "tier": 1,
    "frequency_rank_bccwj": null,
    "notes": "Most neutral first-person pronoun; safe in any register.",
    "tags": ["pronoun", "self-introduction"]
  },
  {
    "id": "anata",
    "kana": "あなた",
    "kanji": null,
    "reading": "あなた",
    "pos": "noun",
    "transitivity": null,
    "english": ["you"],
    "pitch_accent": { "pattern": "nakadaka", "drop_after_mora": 2 },
    "example_sentences": [
      { "kana": "あなた は にほんじん です か。", "kanji": null, "english": "Are you Japanese?" }
    ],
    "module_introduced": 1,
    "tier": 1,
    "frequency_rank_bccwj": null,
    "notes": "Grammatically 'you', but natives prefer name + さん. Fine for drills only.",
    "tags": ["pronoun"]
  },
  {
    "id": "namae",
    "kana": "なまえ",
    "kanji": null,
    "reading": "なまえ",
    "pos": "noun",
    "transitivity": null,
    "english": ["name"],
    "pitch_accent": { "pattern": "nakadaka", "drop_after_mora": 1 },
    "example_sentences": [
      { "kana": "わたし の なまえ は ローラント です。", "kanji": null, "english": "My name is Roland." }
    ],
    "module_introduced": 1,
    "tier": 1,
    "frequency_rank_bccwj": null,
    "notes": null,
    "tags": ["self-introduction"]
  },
  {
    "id": "hito",
    "kana": "ひと",
    "kanji": null,
    "reading": "ひと",
    "pos": "noun",
    "transitivity": null,
    "english": ["person"],
    "pitch_accent": { "pattern": "odaka", "drop_after_mora": 2 },
    "example_sentences": [
      { "kana": "あの ひと は ともだち です。", "kanji": null, "english": "That person is a friend." }
    ],
    "module_introduced": 1,
    "tier": 1,
    "frequency_rank_bccwj": null,
    "notes": "Kanji 人 introduced in Module 04.",
    "tags": []
  },
  {
    "id": "tomodachi",
    "kana": "ともだち",
    "kanji": null,
    "reading": "ともだち",
    "pos": "noun",
    "transitivity": null,
    "english": ["friend"],
    "pitch_accent": { "pattern": "heiban", "drop_after_mora": 0 },
    "example_sentences": [
      { "kana": "マリオさん は わたし の ともだち です。", "kanji": null, "english": "Mario is my friend." }
    ],
    "module_introduced": 1,
    "tier": 1,
    "frequency_rank_bccwj": null,
    "notes": null,
    "tags": ["people"]
  },
  {
    "id": "gakusei",
    "kana": "がくせい",
    "kanji": null,
    "reading": "がくせい",
    "pos": "noun",
    "transitivity": null,
    "english": ["student"],
    "pitch_accent": { "pattern": "heiban", "drop_after_mora": 0 },
    "example_sentences": [
      { "kana": "わたし は がくせい です。", "kanji": null, "english": "I am a student." }
    ],
    "module_introduced": 1,
    "tier": 1,
    "frequency_rank_bccwj": null,
    "notes": null,
    "tags": ["occupation"]
  },
  {
    "id": "sensei",
    "kana": "せんせい",
    "kanji": null,
    "reading": "せんせい",
    "pos": "noun",
    "transitivity": null,
    "english": ["teacher"],
    "pitch_accent": { "pattern": "nakadaka", "drop_after_mora": 3 },
    "example_sentences": [
      { "kana": "ミカさん は せんせい です。", "kanji": null, "english": "Mika is a teacher." }
    ],
    "module_introduced": 1,
    "tier": 1,
    "frequency_rank_bccwj": null,
    "notes": "Also a polite address term for teachers/doctors.",
    "tags": ["occupation"]
  },
  {
    "id": "enjinia",
    "kana": "エンジニア",
    "kanji": null,
    "reading": "エンジニア",
    "pos": "noun",
    "transitivity": null,
    "english": ["engineer"],
    "pitch_accent": null,
    "example_sentences": [
      { "kana": "わたし は エンジニア です。", "kanji": null, "english": "I am an engineer." }
    ],
    "module_introduced": 1,
    "tier": 1,
    "frequency_rank_bccwj": null,
    "notes": "Loanword (katakana). Pitch accent: verify on OJAD.",
    "tags": ["occupation", "loanword", "katakana"]
  },
  {
    "id": "kaishain",
    "kana": "かいしゃいん",
    "kanji": null,
    "reading": "かいしゃいん",
    "pos": "noun",
    "transitivity": null,
    "english": ["company employee", "office worker"],
    "pitch_accent": { "pattern": "heiban", "drop_after_mora": 0 },
    "example_sentences": [
      { "kana": "マリオさん は かいしゃいん です。", "kanji": null, "english": "Mario is a company employee." }
    ],
    "module_introduced": 1,
    "tier": 1,
    "frequency_rank_bccwj": null,
    "notes": "Kanji 会社員 introduced later.",
    "tags": ["occupation"]
  },
  {
    "id": "isha",
    "kana": "いしゃ",
    "kanji": null,
    "reading": "いしゃ",
    "pos": "noun",
    "transitivity": null,
    "english": ["doctor"],
    "pitch_accent": { "pattern": "atamadaka", "drop_after_mora": 1 },
    "example_sentences": [
      { "kana": "わたし は いしゃ じゃありません。", "kanji": null, "english": "I am not a doctor." }
    ],
    "module_introduced": 1,
    "tier": 1,
    "frequency_rank_bccwj": null,
    "notes": "Polite reference to one's own doctor: おいしゃさん.",
    "tags": ["occupation"]
  },
  {
    "id": "kaisha",
    "kana": "かいしゃ",
    "kanji": null,
    "reading": "かいしゃ",
    "pos": "noun",
    "transitivity": null,
    "english": ["company"],
    "pitch_accent": { "pattern": "atamadaka", "drop_after_mora": 1 },
    "example_sentences": [
      { "kana": "これ は わたし の かいしゃ の カメラ です。", "kanji": null, "english": "This is my company's camera." }
    ],
    "module_introduced": 1,
    "tier": 1,
    "frequency_rank_bccwj": null,
    "notes": null,
    "tags": ["work"]
  },
  {
    "id": "nihon",
    "kana": "にほん",
    "kanji": null,
    "reading": "にほん",
    "pos": "noun",
    "transitivity": null,
    "english": ["Japan"],
    "pitch_accent": { "pattern": "heiban", "drop_after_mora": 0 },
    "example_sentences": [
      { "kana": "これ は にほん の くるま です。", "kanji": null, "english": "This is a Japanese car." }
    ],
    "module_introduced": 1,
    "tier": 1,
    "frequency_rank_bccwj": null,
    "notes": "Also read にっぽん in formal/emphatic contexts. にほん [0] heiban is common in modern speech; verify on OJAD.",
    "tags": ["country"]
  },
  {
    "id": "nihonjin",
    "kana": "にほんじん",
    "kanji": null,
    "reading": "にほんじん",
    "pos": "noun",
    "transitivity": null,
    "english": ["Japanese person"],
    "pitch_accent": { "pattern": "nakadaka", "drop_after_mora": 4 },
    "example_sentences": [
      { "kana": "ミカさん は にほんじん です。", "kanji": null, "english": "Mika is Japanese." }
    ],
    "module_introduced": 1,
    "tier": 1,
    "frequency_rank_bccwj": null,
    "notes": "Nationality = country + じん. Kanji 人 in Module 04.",
    "tags": ["nationality"]
  },
  {
    "id": "suisu",
    "kana": "スイス",
    "kanji": null,
    "reading": "スイス",
    "pos": "noun",
    "transitivity": null,
    "english": ["Switzerland"],
    "pitch_accent": { "pattern": "atamadaka", "drop_after_mora": 1 },
    "example_sentences": [
      { "kana": "わたし は スイスじん です。", "kanji": null, "english": "I am Swiss." }
    ],
    "module_introduced": 1,
    "tier": 1,
    "frequency_rank_bccwj": null,
    "notes": "Loanword (katakana). Roland's home country.",
    "tags": ["country", "loanword", "katakana"]
  },
  {
    "id": "suisujin",
    "kana": "スイスじん",
    "kanji": null,
    "reading": "スイスじん",
    "pos": "noun",
    "transitivity": null,
    "english": ["Swiss person"],
    "pitch_accent": null,
    "example_sentences": [
      { "kana": "わたし は スイスじん です。", "kanji": null, "english": "I am Swiss." }
    ],
    "module_introduced": 1,
    "tier": 1,
    "frequency_rank_bccwj": null,
    "notes": "Country + じん. Pitch accent of the compound: verify on OJAD.",
    "tags": ["nationality", "katakana"]
  },
  {
    "id": "hangari",
    "kana": "ハンガリー",
    "kanji": null,
    "reading": "ハンガリー",
    "pos": "noun",
    "transitivity": null,
    "english": ["Hungary"],
    "pitch_accent": null,
    "example_sentences": [
      { "kana": "ハンガリー の カメラ です。", "kanji": null, "english": "It is a Hungarian camera." }
    ],
    "module_introduced": 1,
    "tier": 1,
    "frequency_rank_bccwj": null,
    "notes": "Loanword (katakana). Roland's L1 country. Pitch accent: verify on OJAD.",
    "tags": ["country", "loanword", "katakana"]
  },
  {
    "id": "doitsu",
    "kana": "ドイツ",
    "kanji": null,
    "reading": "ドイツ",
    "pos": "noun",
    "transitivity": null,
    "english": ["Germany"],
    "pitch_accent": { "pattern": "atamadaka", "drop_after_mora": 1 },
    "example_sentences": [
      { "kana": "マリオ は ドイツじん じゃありません。", "kanji": null, "english": "Mario is not German." }
    ],
    "module_introduced": 1,
    "tier": 1,
    "frequency_rank_bccwj": null,
    "notes": "Loanword (katakana).",
    "tags": ["country", "loanword", "katakana"]
  },
  {
    "id": "amerika",
    "kana": "アメリカ",
    "kanji": null,
    "reading": "アメリカ",
    "pos": "noun",
    "transitivity": null,
    "english": ["USA", "America"],
    "pitch_accent": { "pattern": "heiban", "drop_after_mora": 0 },
    "example_sentences": [
      { "kana": "ハナさん は アメリカじん です。", "kanji": null, "english": "Hana is American." }
    ],
    "module_introduced": 1,
    "tier": 1,
    "frequency_rank_bccwj": null,
    "notes": "Loanword (katakana).",
    "tags": ["country", "loanword", "katakana"]
  },
  {
    "id": "itaria",
    "kana": "イタリア",
    "kanji": null,
    "reading": "イタリア",
    "pos": "noun",
    "transitivity": null,
    "english": ["Italy"],
    "pitch_accent": { "pattern": "heiban", "drop_after_mora": 0 },
    "example_sentences": [
      { "kana": "それ は イタリア の くるま です か。", "kanji": null, "english": "Is that an Italian car?" }
    ],
    "module_introduced": 1,
    "tier": 1,
    "frequency_rank_bccwj": null,
    "notes": "Loanword (katakana).",
    "tags": ["country", "loanword", "katakana"]
  },
  {
    "id": "furansu",
    "kana": "フランス",
    "kanji": null,
    "reading": "フランス",
    "pos": "noun",
    "transitivity": null,
    "english": ["France"],